text,x,y,cluster
Генерал Шкуро командовал дивизией в трудных условиях.,110.19514,169.41829,1
Танковая дивизия прорвала оборону противника.,118.60047,153.21834,1
Командование приняло решение об отступлении.,47.69542,100.23116,0
Солдаты пережили тяжелую зиму под Сталинградом.,73.65636,125.87165,0
Артиллерия вела огонь по позициям врага.,82.09884,114.69821,0
Разведчики проникли в тыл противника.,59.353237,90.12184,0
"Получив подкрепление, батальон перешел в наступление.",101.0536,154.69609,1
Фронтовая разведка доложила о передвижении вражеских колонн.,137.27461,173.43707,1
